[
  {
    "decisionSummary": "For MVP critical-path capabilities, only generally available Azure and Fabric services are permitted in production scope.",
    "id": "ADR-0001",
    "sourceCommit": "81ba62b8af0f684be3791a9105f2cf1d4d964726",
    "sourcePath": "docs/adr/0001-ga-only-mvp-critical-path.md",
    "status": "Accepted",
    "title": "GA-Only Services for MVP Critical Path"
  },
  {
    "decisionSummary": "Fabric IQ Ontology is excluded from MVP critical-path scope and moved to a post-MVP feature wave after GA and regional validation.",
    "id": "ADR-0002",
    "sourceCommit": "81ba62b8af0f684be3791a9105f2cf1d4d964726",
    "sourcePath": "docs/adr/0002-defer-fabric-iq-ontology-from-mvp.md",
    "status": "Superseded",
    "supersededBy": [
      "ADR-0014"
    ],
    "title": "Defer Fabric IQ Ontology from MVP"
  },
  {
    "decisionSummary": "PHI-sensitive copilot inference must use Azure OpenAI Standard or Regional Provisioned deployment types in Switzerland regions only.",
    "id": "ADR-0003",
    "sourceCommit": "81ba62b8af0f684be3791a9105f2cf1d4d964726",
    "sourcePath": "docs/adr/0003-swiss-regional-inference-for-phi.md",
    "status": "Accepted",
    "title": "Swiss Regional Inference for PHI-Sensitive Copilot Traffic"
  },
  {
    "decisionSummary": "Global, Data Zone, and Developer deployment types are prohibited for PHI-sensitive copilot traffic in MVP and production scope.",
    "id": "ADR-0004",
    "sourceCommit": "81ba62b8af0f684be3791a9105f2cf1d4d964726",
    "sourcePath": "docs/adr/0004-block-global-and-data-zone-for-phi.md",
    "status": "Accepted",
    "title": "Block Global and Data Zone Inference Modes for PHI Flows"
  },
  {
    "decisionSummary": "A dedicated React web app is mandatory as the MVP copilot experience channel, provided backend data and AI services follow Swiss residency and governance constraints.",
    "id": "ADR-0005",
    "sourceCommit": "81ba62b8af0f684be3791a9105f2cf1d4d964726",
    "sourcePath": "docs/adr/0005-approve-react-channel-as-ga-safe.md",
    "status": "Accepted",
    "title": "Approve Dedicated React Web App as GA-Safe Copilot Channel"
  },
  {
    "decisionSummary": "Any preview-only feature is classified as non-production for regulated data unless an explicit exception is approved through governance review.",
    "id": "ADR-0006",
    "sourceCommit": "81ba62b8af0f684be3791a9105f2cf1d4d964726",
    "sourcePath": "docs/adr/0006-preview-features-non-production-rule.md",
    "status": "Accepted",
    "title": "Preview Features Are Non-Production for Regulated Data"
  },
  {
    "decisionSummary": "",
    "id": "ADR-0007",
    "sourceCommit": "81ba62b8af0f684be3791a9105f2cf1d4d964726",
    "sourcePath": "docs/adr/0007-0011-hardening-delta-summary.md",
    "status": "Accepted",
    "title": "Hardening Delta Summary"
  },
  {
    "decisionSummary": "For MVP and PROD baseline:",
    "id": "ADR-0007",
    "sourceCommit": "81ba62b8af0f684be3791a9105f2cf1d4d964726",
    "sourcePath": "docs/adr/0007-mvp-agent-runtime-and-hitl-release-gates.md",
    "status": "Accepted",
    "title": "MVP Agent Runtime Choices and HITL Release Gates"
  },
  {
    "decisionSummary": "For Sprint 5 and MVP execution:",
    "id": "ADR-0008",
    "sourceCommit": "81ba62b8af0f684be3791a9105f2cf1d4d964726",
    "sourcePath": "docs/adr/0008-agent-runtime-pattern-scope-and-selection.md",
    "status": "Accepted",
    "title": "Agent Runtime Pattern Scope and Selection"
  },
  {
    "decisionSummary": "For Sprint 5 execution and MVP promotion controls:",
    "id": "ADR-0009",
    "sourceCommit": "81ba62b8af0f684be3791a9105f2cf1d4d964726",
    "sourcePath": "docs/adr/0009-reliability-and-dr-baseline-for-sit-prod.md",
    "status": "Accepted",
    "title": "Reliability and Disaster Recovery Baseline for SIT and PROD"
  },
  {
    "decisionSummary": "For Sprint 5 and subsequent release cycles:",
    "id": "ADR-0010",
    "sourceCommit": "81ba62b8af0f684be3791a9105f2cf1d4d964726",
    "sourcePath": "docs/adr/0010-policy-as-code-and-release-evidence-gates.md",
    "status": "Accepted",
    "title": "Policy-as-Code and Release Evidence Gates"
  },
  {
    "decisionSummary": "For Sprint 5 and public-sector promotion governance:",
    "id": "ADR-0011",
    "sourceCommit": "81ba62b8af0f684be3791a9105f2cf1d4d964726",
    "sourcePath": "docs/adr/0011-cantonal-legal-applicability-gate.md",
    "status": "Accepted",
    "title": "Cantonal Legal Applicability Gate for Production Promotion"
  },
  {
    "decisionSummary": "Rebuild SIT and PROD in the new tenant using a single shared subscription `66a9953a-df37-4c51-856c-9971b9bf3e03` (demo simplification per D9) in region `westus2` (per [ADR-0013](0013-temporary-us-region-demo-scope.md)). Solution short name renamed `chhealthpf` → `ihzhhpf` in live/authoritative files only; historical sprint/spec docs preserve the audit trail. Old tenant remains operational; teardown is deferred to a separate later decision.",
    "id": "ADR-0012",
    "sourceCommit": "81ba62b8af0f684be3791a9105f2cf1d4d964726",
    "sourcePath": "docs/adr/0012-tenant-migration-to-mcap164444.md",
    "status": "Accepted",
    "title": "Tenant migration to MCAP164444"
  },
  {
    "decisionSummary": "For the **new-tenant demo scope only**, deploy Azure resources in **`westus2`** to unblock validation of services that are not yet GA in `switzerlandnorth`.",
    "id": "ADR-0013",
    "sourceCommit": "81ba62b8af0f684be3791a9105f2cf1d4d964726",
    "sourcePath": "docs/adr/0013-temporary-us-region-demo-scope.md",
    "status": "Accepted",
    "title": "Temporary US-region demo scope on new tenant"
  },
  {
    "decisionSummary": "**Adopt Fabric IQ Ontology as the target operational semantic backbone for the integral HCC tier, gated on Switzerland-region GA. Author the reference layer (BFO / OBO in OWL/RDF) in parallel and portably, so that operational realisation is de-risked against Fabric IQ preview status and Switzerland-region GA timing.**",
    "id": "ADR-0014",
    "sourceCommit": "81ba62b8af0f684be3791a9105f2cf1d4d964726",
    "sourcePath": "docs/adr/0014-fabric-iq-ontology-target-backbone-ga-gated.md",
    "status": "Proposed",
    "supersedes": [
      "ADR-0002"
    ],
    "title": "Fabric IQ Ontology as target semantic backbone (GA-gated)"
  },
  {
    "decisionSummary": "For the MVP demo scope, the platform ingests data via **two Fabric-native paths only**:",
    "id": "ADR-0015",
    "sourceCommit": "81ba62b8af0f684be3791a9105f2cf1d4d964726",
    "sourcePath": "docs/adr/0015-skip-sql-for-mvp-demo.md",
    "status": "Proposed",
    "title": "Skip SQL for MVP demo"
  },
  {
    "decisionSummary": "In the demo scope (as defined by ADR-0013):",
    "id": "ADR-0016",
    "sourceCommit": "81ba62b8af0f684be3791a9105f2cf1d4d964726",
    "sourcePath": "docs/adr/0016-no-phi-in-mvp-demo-scope.md",
    "status": "Accepted",
    "title": "No PHI in MVP demo scope"
  },
  {
    "decisionSummary": "Bump [`docs/sprints/sprint-09-master-data-simulation-and-capacity-dashboard.md`](../sprints/sprint-09-master-data-simulation-and-capacity-dashboard.md) from **1.3.0 → 2.0.0** (MAJOR per [`.github/copilot-instructions.md` §9 Document Versioning](../../.github/copilot-instructions.md#9-document-versioning)). Old track headings are removed; the migration path is: readers consult the design spec §7.2 deliverable table for the authoritative mapping from the v1.x scope to the v2 track structure.",
    "id": "ADR-0017",
    "sourceCommit": "81ba62b8af0f684be3791a9105f2cf1d4d964726",
    "sourcePath": "docs/adr/0017-sprint-09-v2-track-restructure.md",
    "status": "Accepted",
    "title": "Sprint 09 v2.0.0 Track Restructure"
  },
  {
    "decisionSummary": "**Formalise the four IDs in PRD.md.** Add two new PRD sub-sections at the end of their respective (FR / NFR) top-level sections so no existing anchors break:",
    "id": "ADR-0018",
    "sourceCommit": "81ba62b8af0f684be3791a9105f2cf1d4d964726",
    "sourcePath": "docs/adr/0018-add-fr-viz-and-nfr-gov-ids.md",
    "status": "Accepted",
    "title": "Formalise `FR-VIZ-*` and `NFR-GOV-*` requirement IDs in PRD"
  },
  {
    "decisionSummary": "For the SIT MCAPS-hosted demo scope only, pivot the Sprint 10 T1 ingest architecture:",
    "id": "ADR-0019",
    "sourceCommit": "81ba62b8af0f684be3791a9105f2cf1d4d964726",
    "sourcePath": "docs/adr/0019-fabric-eventstream-custom-endpoint-entra-id.md",
    "status": "Accepted",
    "title": "Fabric Eventstream ingest via Custom Endpoint + Entra ID (MCAPS baseline forced pivot)"
  },
  {
    "decisionSummary": "1. All Sprint 11 agents share a **single frontier chat-completion deployment** in the `westus2` demo Foundry project per ADR-0013 (demo scope only). The deployment name is referenced by each agent manifest as `modelDeploymentRef: sprint11-chat` — the concrete Azure deployment name is resolved at Sprint 13 agent-host configuration time and is **not** hard-coded in any prompt, manifest, or workflow. 2. This deployment is **synthetic-data-only**. Per ADR-0006 and ADR-0016 it is **non-production for regulated data** and must never process real PHI. Enforcement is layered: agent refusal rules (per-agent `AGENT.md`), the synthetic-only Sprint 10 Gold tables, and the `data-quality-agent` PHI gate. 3. Every Sprint 11 agent `AGENT.md` **references this ADR** in its Identity or Grounding section so that the model-selection decision is traceable from the agent to the constraint set above. 4. When the platform sunsets ADR-0013 and returns to Switzerland North, this ADR is **superseded** by a new ADR that pins Swiss-resident deployments per agent and lifts the synthetic-only restriction for regulated data.",
    "id": "ADR-0020",
    "sourceCommit": "81ba62b8af0f684be3791a9105f2cf1d4d964726",
    "sourcePath": "docs/adr/0020-sprint11-agent-model-selection.md",
    "status": "Accepted",
    "title": "Sprint 11 agent model selection"
  },
  {